{"schemaVersion":2,"contract":"cost-attribution-list","requestId":"request-synthetic","asOf":"2026-10-14T08:00:00+00:00","items":[{"revisionId":"attribution-synthetic","walletId":"wallet-synthetic","rootCostId":"cost-synthetic","costId":"cost-synthetic","priorRevisionId":null,"reason":"Explicit paper cost ownership","policyVersion":"manual-paper-cost-attribution-v1","recordedByUserId":"user-synthetic","knownAtUtc":"2026-10-14T08:00:00+00:00","publicationSequence":3,"needsReconciliation":false,"assetId":"asset-usdt-synthetic","sourceAmount":"1.25","unassignedAmount":"0.25","unassignedWithheldReason":null,"amountAttributionComplete":false,"allocations":[{"setupId":"setup-synthetic","attemptId":"attempt-synthetic","amount":"1"}]}],"eTag":"\u0022synthetic-cost-attribution-etag\u0022","nextCursor":null,"publicationWatermark":3,"snapshotCursor":"synthetic-cost-attribution-snapshot"}
